<?xml version="1.0" encoding="UTF-8"?>
<tns:configuration xmlns:tns="http://www.bakery.at/kippen" xmlns:xsi="http://www.w3.org/2001/XMLSchema-instance" xsi:schemaLocation="http://www.bakery.at/kippen config.xsd ">
  <ableton>
    <ip>localhost</ip>
    <port>9999</port>
  </ableton>
  <objects>
    <KippenObject>
      <mac>mac</mac>
      <type>cube</type>
      <events>
        <event eventType="sideChange">
          <commands>
            <command commandType="">
              <commandParams key="" value=""/>
            </command>
            
          </commands>
        </event>
        
      </events>
      
    </KippenObject>
  </objects>
</tns:configuration>
